04/11/2024 01:23:58	en0	Ether / IP / TCP 192.168.29.3:57132 > 152.195.38.76:http S
04/11/2024 01:23:58	en0	Ether / IP / TCP 192.168.29.3:57132 > 152.195.38.76:http S
04/11/2024 01:23:58	en0	Ether / IP / TCP 152.195.38.76:http > 192.168.29.3:57132 SA
04/11/2024 01:23:58	en0	Ether / IP / TCP 152.195.38.76:http > 192.168.29.3:57132 SA
04/11/2024 01:23:58	en0	Ether / IP / TCP 192.168.29.3:57132 > 152.195.38.76:http A
04/11/2024 01:23:58	en0	Ether / IP / TCP 192.168.29.3:57132 > 152.195.38.76:http A
04/11/2024 01:23:58	en0	Ether / IP / TCP / HTTP / GET '/ME8wTTBLMEkwRzAHBgUrDgMCGgQU36oS4yixCUGT4p9Cgs5HQEKVWKMEFLE%2Bw2kD%2BL9HAdSYJhoIAu9jZCvDAhAHF3kRAF0iZ%2FaIkvaPi1BY' 
04/11/2024 01:23:58	en0	Ether / IP / TCP / HTTP / GET '/ME8wTTBLMEkwRzAHBgUrDgMCGgQU36oS4yixCUGT4p9Cgs5HQEKVWKMEFLE%2Bw2kD%2BL9HAdSYJhoIAu9jZCvDAhAHF3kRAF0iZ%2FaIkvaPi1BY' 
04/11/2024 01:23:58	en0	Ether / IP / TCP 152.195.38.76:http > 192.168.29.3:57132 A
04/11/2024 01:23:58	en0	Ether / IP / TCP 152.195.38.76:http > 192.168.29.3:57132 A
04/11/2024 01:23:58	en0	Ether / IP / TCP / HTTP / 200 OK / Raw
04/11/2024 01:23:58	en0	Ether / IP / TCP / HTTP / 200 OK / Raw
04/11/2024 01:23:58	en0	Ether / IP / TCP 192.168.29.3:57132 > 152.195.38.76:http A
04/11/2024 01:23:58	en0	Ether / IP / TCP 192.168.29.3:57132 > 152.195.38.76:http A
04/11/2024 01:24:58	en0	Ether / IP / TCP 192.168.29.3:57132 > 152.195.38.76:http FA
04/11/2024 01:24:58	en0	Ether / IP / TCP 192.168.29.3:57132 > 152.195.38.76:http FA
04/11/2024 01:24:58	en0	Ether / IP / TCP 152.195.38.76:http > 192.168.29.3:57132 FA
04/11/2024 01:24:58	en0	Ether / IP / TCP 152.195.38.76:http > 192.168.29.3:57132 FA
04/11/2024 01:24:58	en0	Ether / IP / TCP 192.168.29.3:57132 > 152.195.38.76:http A
04/11/2024 01:24:58	en0	Ether / IP / TCP 192.168.29.3:57132 > 152.195.38.76:http A
04/11/2024 01:59:18	en0	Ether / IP / TCP 192.168.29.3:57382 > 129.94.254.36:http S
04/11/2024 01:59:18	en0	Ether / IP / TCP 192.168.29.3:57382 > 129.94.254.36:http S
04/11/2024 01:59:18	en0	Ether / IP / TCP 192.168.29.3:57382 > 129.94.254.36:http S
04/11/2024 01:59:18	en0	Ether / IP / TCP 192.168.29.3:57382 > 129.94.254.36:http S
04/11/2024 03:35:16	en0	Ether / IP / TCP 192.168.1.101:49358 > 152.195.38.76:http S
04/11/2024 03:35:16	en0	Ether / IP / TCP 192.168.1.101:49358 > 152.195.38.76:http S
04/11/2024 03:35:16	en0	Ether / IP / TCP 152.195.38.76:http > 192.168.1.101:49358 SA
04/11/2024 03:35:16	en0	Ether / IP / TCP 152.195.38.76:http > 192.168.1.101:49358 SA
04/11/2024 03:35:16	en0	Ether / IP / TCP 192.168.1.101:49358 > 152.195.38.76:http A
04/11/2024 03:35:16	en0	Ether / IP / TCP 192.168.1.101:49358 > 152.195.38.76:http A
04/11/2024 03:35:16	en0	Ether / IP / TCP / HTTP / GET '/ME8wTTBLMEkwRzAHBgUrDgMCGgQU6468nUcrfgKRdxkj8qXxwcUeV7UEFLPbSKT5ocXYrjZBzBFjaWIpvEvGAhAMq6rRzsTpfMJmWIHQITj3' 
04/11/2024 03:35:16	en0	Ether / IP / TCP / HTTP / GET '/ME8wTTBLMEkwRzAHBgUrDgMCGgQU6468nUcrfgKRdxkj8qXxwcUeV7UEFLPbSKT5ocXYrjZBzBFjaWIpvEvGAhAMq6rRzsTpfMJmWIHQITj3' 
04/11/2024 03:35:16	en0	Ether / IP / TCP 152.195.38.76:http > 192.168.1.101:49358 A
04/11/2024 03:35:16	en0	Ether / IP / TCP 152.195.38.76:http > 192.168.1.101:49358 A
04/11/2024 03:35:16	en0	Ether / IP / TCP / HTTP / 200 OK / Raw
04/11/2024 03:35:16	en0	Ether / IP / TCP / HTTP / 200 OK / Raw
04/11/2024 03:35:16	en0	Ether / IP / TCP 192.168.1.101:49358 > 152.195.38.76:http A
04/11/2024 03:35:16	en0	Ether / IP / TCP 192.168.1.101:49358 > 152.195.38.76:http A
04/11/2024 03:51:03	en0	Ether / IP / TCP 192.168.1.101:49361 > 152.195.38.76:http S
04/11/2024 03:51:03	en0	Ether / IP / TCP 192.168.1.101:49361 > 152.195.38.76:http S
04/11/2024 03:51:03	en0	Ether / IP / TCP 152.195.38.76:http > 192.168.1.101:49361 SA
04/11/2024 03:51:03	en0	Ether / IP / TCP 152.195.38.76:http > 192.168.1.101:49361 SA
04/11/2024 03:51:03	en0	Ether / IP / TCP 192.168.1.101:49361 > 152.195.38.76:http A
04/11/2024 03:51:03	en0	Ether / IP / TCP 192.168.1.101:49361 > 152.195.38.76:http A
04/11/2024 03:51:03	en0	Ether / IP / TCP / HTTP / GET '/ME8wTTBLMEkwRzAHBgUrDgMCGgQU36oS4yixCUGT4p9Cgs5HQEKVWKMEFLE%2Bw2kD%2BL9HAdSYJhoIAu9jZCvDAhAHF3kRAF0iZ%2FaIkvaPi1BY' 
04/11/2024 03:51:03	en0	Ether / IP / TCP / HTTP / GET '/ME8wTTBLMEkwRzAHBgUrDgMCGgQU36oS4yixCUGT4p9Cgs5HQEKVWKMEFLE%2Bw2kD%2BL9HAdSYJhoIAu9jZCvDAhAHF3kRAF0iZ%2FaIkvaPi1BY' 
04/11/2024 03:51:03	en0	Ether / IP / TCP 152.195.38.76:http > 192.168.1.101:49361 A
04/11/2024 03:51:03	en0	Ether / IP / TCP 152.195.38.76:http > 192.168.1.101:49361 A
04/11/2024 03:51:03	en0	Ether / IP / TCP / HTTP / 200 OK / Raw
04/11/2024 03:51:03	en0	Ether / IP / TCP / HTTP / 200 OK / Raw
04/11/2024 03:51:03	en0	Ether / IP / TCP 192.168.1.101:49361 > 152.195.38.76:http A
04/11/2024 03:51:03	en0	Ether / IP / TCP 192.168.1.101:49361 > 152.195.38.76:http A
04/11/2024 03:51:04	en0	Ether / IP / TCP 192.168.1.101:49365 > 152.195.38.76:http S
04/11/2024 03:51:04	en0	Ether / IP / TCP 192.168.1.101:49365 > 152.195.38.76:http S
04/11/2024 03:51:04	en0	Ether / IP / TCP 152.195.38.76:http > 192.168.1.101:49365 SA
04/11/2024 03:51:04	en0	Ether / IP / TCP 152.195.38.76:http > 192.168.1.101:49365 SA
04/11/2024 03:51:04	en0	Ether / IP / TCP 192.168.1.101:49365 > 152.195.38.76:http A
04/11/2024 03:51:04	en0	Ether / IP / TCP 192.168.1.101:49365 > 152.195.38.76:http A
04/11/2024 03:51:04	en0	Ether / IP / TCP / HTTP / GET '/ME8wTTBLMEkwRzAHBgUrDgMCGgQUwS9Fdu0VWeywXbqJv52AeOUj1BMEFOWdWTCCR1jMrPoIVDaGezq1BE3wAhAFUsfv%2FuwpK6nxOHsHr5Kf' 
04/11/2024 03:51:04	en0	Ether / IP / TCP / HTTP / GET '/ME8wTTBLMEkwRzAHBgUrDgMCGgQUwS9Fdu0VWeywXbqJv52AeOUj1BMEFOWdWTCCR1jMrPoIVDaGezq1BE3wAhAFUsfv%2FuwpK6nxOHsHr5Kf' 
04/11/2024 03:51:04	en0	Ether / IP / TCP 152.195.38.76:http > 192.168.1.101:49365 A
04/11/2024 03:51:04	en0	Ether / IP / TCP 152.195.38.76:http > 192.168.1.101:49365 A
04/11/2024 03:51:04	en0	Ether / IP / TCP / HTTP / 200 OK / Raw
04/11/2024 03:51:04	en0	Ether / IP / TCP 192.168.1.101:49365 > 152.195.38.76:http A
04/11/2024 03:51:04	en0	Ether / IP / TCP / HTTP / 200 OK / Raw
04/11/2024 03:51:04	en0	Ether / IP / TCP 152.195.38.76:http > 192.168.1.101:49365 PA / HTTP / Raw
04/11/2024 03:51:04	en0	Ether / IP / TCP 192.168.1.101:49365 > 152.195.38.76:http A
04/11/2024 03:51:04	en0	Ether / IP / TCP 192.168.1.101:49365 > 152.195.38.76:http A
04/11/2024 03:51:04	en0	Ether / IP / TCP 152.195.38.76:http > 192.168.1.101:49365 PA / HTTP / Raw
04/11/2024 03:51:04	en0	Ether / IP / TCP 192.168.1.101:49365 > 152.195.38.76:http A
04/11/2024 04:33:41	en0	Ether / IP / TCP 192.168.1.101:49358 > 152.195.38.76:http FA
04/11/2024 04:33:41	en0	Ether / IP / TCP 192.168.1.101:49358 > 152.195.38.76:http FA
04/11/2024 04:44:07	en0	Ether / IP / TCP 192.168.1.101:49358 > 152.195.38.76:http FA
04/11/2024 04:44:07	en0	Ether / IP / TCP 192.168.1.101:49358 > 152.195.38.76:http FA
04/11/2024 04:44:07	en0	Ether / IP / TCP 192.168.1.101:49358 > 152.195.38.76:http FA
04/11/2024 04:44:07	en0	Ether / IP / TCP 192.168.1.101:49358 > 152.195.38.76:http FA
04/11/2024 04:44:08	en0	Ether / IP / TCP 192.168.1.101:49358 > 152.195.38.76:http FA
04/11/2024 04:44:08	en0	Ether / IP / TCP 192.168.1.101:49358 > 152.195.38.76:http FA
04/11/2024 04:44:08	en0	Ether / IP / TCP 192.168.1.101:49358 > 152.195.38.76:http FA
04/11/2024 04:44:08	en0	Ether / IP / TCP 192.168.1.101:49358 > 152.195.38.76:http FA
04/11/2024 04:44:10	en0	Ether / IP / TCP 192.168.1.101:49358 > 152.195.38.76:http FA
04/11/2024 04:44:10	en0	Ether / IP / TCP 192.168.1.101:49358 > 152.195.38.76:http FA
04/11/2024 04:44:12	en0	Ether / IP / TCP 192.168.1.101:49358 > 152.195.38.76:http FA
04/11/2024 04:44:12	en0	Ether / IP / TCP 192.168.1.101:49358 > 152.195.38.76:http FA
04/11/2024 04:44:12	en0	Ether / IP / TCP 192.168.1.101:49361 > 152.195.38.76:http FA
04/11/2024 04:44:12	en0	Ether / IP / TCP 192.168.1.101:49361 > 152.195.38.76:http FA
04/11/2024 04:44:12	en0	Ether / IP / TCP 192.168.1.101:49361 > 152.195.38.76:http FA
04/11/2024 04:44:12	en0	Ether / IP / TCP 192.168.1.101:49361 > 152.195.38.76:http FA
04/11/2024 04:44:13	en0	Ether / IP / TCP 192.168.1.101:49365 > 152.195.38.76:http FA
04/11/2024 04:44:13	en0	Ether / IP / TCP 192.168.1.101:49365 > 152.195.38.76:http FA
04/11/2024 04:44:13	en0	Ether / IP / TCP 192.168.1.101:49361 > 152.195.38.76:http FA
04/11/2024 04:44:13	en0	Ether / IP / TCP 192.168.1.101:49361 > 152.195.38.76:http FA
04/11/2024 04:44:13	en0	Ether / IP / TCP 192.168.1.101:49365 > 152.195.38.76:http FA
04/11/2024 04:44:13	en0	Ether / IP / TCP 192.168.1.101:49365 > 152.195.38.76:http FA
04/11/2024 04:44:13	en0	Ether / IP / TCP 192.168.1.101:49361 > 152.195.38.76:http FA
04/11/2024 04:44:13	en0	Ether / IP / TCP 192.168.1.101:49361 > 152.195.38.76:http FA
04/11/2024 04:44:13	en0	Ether / IP / TCP 192.168.1.101:49365 > 152.195.38.76:http FA
04/11/2024 04:44:13	en0	Ether / IP / TCP 192.168.1.101:49365 > 152.195.38.76:http FA
04/11/2024 05:00:05	en0	Ether / IP / TCP 192.168.1.101:49365 > 152.195.38.76:http FA
04/11/2024 05:00:05	en0	Ether / IP / TCP 192.168.1.101:49361 > 152.195.38.76:http FA
04/11/2024 05:00:05	en0	Ether / IP / TCP 192.168.1.101:49365 > 152.195.38.76:http FA
04/11/2024 05:00:05	en0	Ether / IP / TCP 192.168.1.101:49361 > 152.195.38.76:http FA
04/11/2024 05:00:05	en0	Ether / IP / TCP 192.168.1.101:49365 > 152.195.38.76:http FA
04/11/2024 05:00:05	en0	Ether / IP / TCP 192.168.1.101:49365 > 152.195.38.76:http FA
04/11/2024 05:00:06	en0	Ether / IP / TCP 192.168.1.101:49361 > 152.195.38.76:http FA
04/11/2024 05:00:06	en0	Ether / IP / TCP 192.168.1.101:49361 > 152.195.38.76:http FA
04/11/2024 05:00:06	en0	Ether / IP / TCP 192.168.1.101:49358 > 152.195.38.76:http FA
04/11/2024 05:00:06	en0	Ether / IP / TCP 192.168.1.101:49358 > 152.195.38.76:http FA
04/11/2024 05:00:07	en0	Ether / IP / TCP 192.168.1.101:49365 > 152.195.38.76:http FA
04/11/2024 05:00:07	en0	Ether / IP / TCP 192.168.1.101:49365 > 152.195.38.76:http FA
04/11/2024 05:00:08	en0	Ether / IP / TCP 192.168.1.101:49361 > 152.195.38.76:http FA
04/11/2024 05:00:08	en0	Ether / IP / TCP 192.168.1.101:49361 > 152.195.38.76:http FA
04/11/2024 05:00:09	en0	Ether / IP / TCP 192.168.1.101:49365 > 152.195.38.76:http FA
04/11/2024 05:00:09	en0	Ether / IP / TCP 192.168.1.101:49365 > 152.195.38.76:http FA
04/11/2024 05:00:15	en0	Ether / IP / TCP 192.168.1.101:49358 > 152.195.38.76:http FA
04/11/2024 05:00:15	en0	Ether / IP / TCP 192.168.1.101:49358 > 152.195.38.76:http FA
04/11/2024 05:00:17	en0	Ether / IP / TCP 192.168.1.101:49361 > 152.195.38.76:http FA
04/11/2024 05:00:17	en0	Ether / IP / TCP 192.168.1.101:49361 > 152.195.38.76:http FA
04/11/2024 05:00:18	en0	Ether / IP / TCP 192.168.1.101:49365 > 152.195.38.76:http FA
04/11/2024 05:00:18	en0	Ether / IP / TCP 192.168.1.101:49365 > 152.195.38.76:http FA
04/11/2024 05:00:19	en0	Ether / IP / TCP 192.168.1.101:49358 > 152.195.38.76:http FA
04/11/2024 05:00:19	en0	Ether / IP / TCP 192.168.1.101:49358 > 152.195.38.76:http FA
04/11/2024 05:00:21	en0	Ether / IP / TCP 192.168.1.101:49361 > 152.195.38.76:http FA
04/11/2024 05:00:21	en0	Ether / IP / TCP 192.168.1.101:49361 > 152.195.38.76:http FA
04/11/2024 05:00:22	en0	Ether / IP / TCP 192.168.1.101:49365 > 152.195.38.76:http FA
04/11/2024 05:00:22	en0	Ether / IP / TCP 192.168.1.101:49365 > 152.195.38.76:http FA
04/11/2024 05:00:23	en0	Ether / IP / TCP 192.168.1.101:49358 > 152.195.38.76:http FA
04/11/2024 05:00:23	en0	Ether / IP / TCP 192.168.1.101:49358 > 152.195.38.76:http FA
04/11/2024 05:16:43	en0	Ether / IP / TCP 192.168.1.101:49361 > 152.195.38.76:http FA
04/11/2024 05:16:43	en0	Ether / IP / TCP 192.168.1.101:49361 > 152.195.38.76:http FA
04/11/2024 05:16:44	en0	Ether / IP / TCP 192.168.1.101:49365 > 152.195.38.76:http FA
04/11/2024 05:16:44	en0	Ether / IP / TCP 192.168.1.101:49365 > 152.195.38.76:http FA
04/11/2024 05:16:45	en0	Ether / IP / TCP 192.168.1.101:49358 > 152.195.38.76:http FA
04/11/2024 05:16:45	en0	Ether / IP / TCP 192.168.1.101:49358 > 152.195.38.76:http FA
04/11/2024 05:16:47	en0	Ether / IP / TCP 192.168.1.101:49361 > 152.195.38.76:http FA
04/11/2024 05:16:47	en0	Ether / IP / TCP 192.168.1.101:49361 > 152.195.38.76:http FA
04/11/2024 05:31:56	en0	Ether / IP / TCP 192.168.1.101:49365 > 152.195.38.76:http FA
04/11/2024 05:31:56	en0	Ether / IP / TCP 192.168.1.101:49365 > 152.195.38.76:http FA
04/11/2024 05:31:57	en0	Ether / IP / TCP 192.168.1.101:49358 > 152.195.38.76:http FA
04/11/2024 05:31:57	en0	Ether / IP / TCP 192.168.1.101:49358 > 152.195.38.76:http FA
04/11/2024 05:31:59	en0	Ether / IP / TCP 192.168.1.101:49361 > 152.195.38.76:http FA
04/11/2024 05:31:59	en0	Ether / IP / TCP 192.168.1.101:49361 > 152.195.38.76:http FA
04/11/2024 05:32:00	en0	Ether / IP / TCP 192.168.1.101:49365 > 152.195.38.76:http FA
04/11/2024 05:32:00	en0	Ether / IP / TCP 192.168.1.101:49365 > 152.195.38.76:http FA
04/11/2024 05:32:01	en0	Ether / IP / TCP 192.168.1.101:49358 > 152.195.38.76:http RA
04/11/2024 05:32:01	en0	Ether / IP / TCP 192.168.1.101:49358 > 152.195.38.76:http RA
04/11/2024 05:37:20	en0	Ether / IP / TCP 192.168.1.101:49361 > 152.195.38.76:http FA
04/11/2024 05:37:20	en0	Ether / IP / TCP 192.168.1.101:49361 > 152.195.38.76:http FA
04/11/2024 05:37:21	en0	Ether / IP / TCP 192.168.1.101:49365 > 152.195.38.76:http FA
04/11/2024 05:37:21	en0	Ether / IP / TCP 192.168.1.101:49365 > 152.195.38.76:http FA
04/11/2024 05:37:24	en0	Ether / IP / TCP 192.168.1.101:49361 > 152.195.38.76:http RA
04/11/2024 05:37:24	en0	Ether / IP / TCP 192.168.1.101:49361 > 152.195.38.76:http RA
04/11/2024 05:53:37	en0	Ether / IP / TCP 192.168.1.101:49365 > 152.195.38.76:http RA
04/11/2024 05:53:37	en0	Ether / IP / TCP 192.168.1.101:49365 > 152.195.38.76:http RA
04/11/2024 07:08:51	en0	Ether / IP / TCP 192.168.1.101:49544 > 192.124.249.23:http S
04/11/2024 07:08:51	en0	Ether / IP / TCP 192.168.1.101:49544 > 192.124.249.23:http S
04/11/2024 07:08:51	en0	Ether / IP / TCP 192.124.249.23:http > 192.168.1.101:49544 SA
04/11/2024 07:08:51	en0	Ether / IP / TCP 192.168.1.101:49544 > 192.124.249.23:http A
04/11/2024 07:08:51	en0	Ether / IP / TCP 192.124.249.23:http > 192.168.1.101:49544 SA
04/11/2024 07:08:51	en0	Ether / IP / TCP 192.168.1.101:49544 > 192.124.249.23:http A
04/11/2024 07:08:51	en0	Ether / IP / TCP / HTTP / GET '//MEAwPjA8MDowODAHBgUrDgMCGgQUHSNvjgZLlx%2Fd36EVI%2BGu5QK%2BKxsEFDqahQcQZyi27%2Fa9BUFuIMGU2g%2FeAgEH' 
04/11/2024 07:08:51	en0	Ether / IP / TCP / HTTP / GET '//MEAwPjA8MDowODAHBgUrDgMCGgQUHSNvjgZLlx%2Fd36EVI%2BGu5QK%2BKxsEFDqahQcQZyi27%2Fa9BUFuIMGU2g%2FeAgEH' 
04/11/2024 07:08:51	en0	Ether / IP / TCP 192.124.249.23:http > 192.168.1.101:49544 A
04/11/2024 07:08:51	en0	Ether / IP / TCP 192.124.249.23:http > 192.168.1.101:49544 A
04/11/2024 07:08:51	en0	Ether / IP / TCP / HTTP / 200 OK / Raw
04/11/2024 07:08:51	en0	Ether / IP / TCP / HTTP / 200 OK / Raw
04/11/2024 07:08:51	en0	Ether / IP / TCP 192.124.249.23:http > 192.168.1.101:49544 PA / HTTP / Raw
04/11/2024 07:08:51	en0	Ether / IP / TCP 192.124.249.23:http > 192.168.1.101:49544 PA / HTTP / Raw
04/11/2024 07:08:51	en0	Ether / IP / TCP 192.168.1.101:49544 > 192.124.249.23:http A
04/11/2024 07:08:51	en0	Ether / IP / TCP 192.168.1.101:49544 > 192.124.249.23:http A
04/11/2024 07:08:53	en0	Ether / IP / TCP 192.168.1.101:49550 > 152.195.38.76:http S
04/11/2024 07:08:53	en0	Ether / IP / TCP 192.168.1.101:49550 > 152.195.38.76:http S
04/11/2024 07:08:53	en0	Ether / IP / TCP 152.195.38.76:http > 192.168.1.101:49550 SA
04/11/2024 07:08:53	en0	Ether / IP / TCP 192.168.1.101:49550 > 152.195.38.76:http A
04/11/2024 07:08:53	en0	Ether / IP / TCP 152.195.38.76:http > 192.168.1.101:49550 SA
04/11/2024 07:08:53	en0	Ether / IP / TCP / HTTP / GET '/ME8wTTBLMEkwRzAHBgUrDgMCGgQUwS9Fdu0VWeywXbqJv52AeOUj1BMEFOWdWTCCR1jMrPoIVDaGezq1BE3wAhAFUsfv%2FuwpK6nxOHsHr5Kf' 
04/11/2024 07:08:53	en0	Ether / IP / TCP 192.168.1.101:49550 > 152.195.38.76:http A
04/11/2024 07:08:53	en0	Ether / IP / TCP / HTTP / GET '/ME8wTTBLMEkwRzAHBgUrDgMCGgQUwS9Fdu0VWeywXbqJv52AeOUj1BMEFOWdWTCCR1jMrPoIVDaGezq1BE3wAhAFUsfv%2FuwpK6nxOHsHr5Kf' 
04/11/2024 07:08:53	en0	Ether / IP / TCP 152.195.38.76:http > 192.168.1.101:49550 A
04/11/2024 07:08:53	en0	Ether / IP / TCP 152.195.38.76:http > 192.168.1.101:49550 A
04/11/2024 07:08:53	en0	Ether / IP / TCP / HTTP / 200 OK / Raw
04/11/2024 07:08:53	en0	Ether / IP / TCP 152.195.38.76:http > 192.168.1.101:49550 PA / HTTP / Raw
04/11/2024 07:08:53	en0	Ether / IP / TCP 192.168.1.101:49550 > 152.195.38.76:http A
04/11/2024 07:08:53	en0	Ether / IP / TCP / HTTP / 200 OK / Raw
04/11/2024 07:08:53	en0	Ether / IP / TCP 152.195.38.76:http > 192.168.1.101:49550 PA / HTTP / Raw
04/11/2024 07:08:53	en0	Ether / IP / TCP 192.168.1.101:49550 > 152.195.38.76:http A
04/11/2024 07:08:53	en0	Ether / IP / TCP 192.168.1.101:49555 > 152.195.38.76:http S
04/11/2024 07:08:53	en0	Ether / IP / TCP 192.168.1.101:49555 > 152.195.38.76:http S
04/11/2024 07:08:53	en0	Ether / IP / TCP 192.168.1.101:49555 > 152.195.38.76:http S
04/11/2024 07:08:53	en0	Ether / IP / TCP 192.168.1.101:49555 > 152.195.38.76:http S
04/11/2024 07:08:53	en0	Ether / IP / TCP 152.195.38.76:http > 192.168.1.101:49555 SA
04/11/2024 07:08:53	en0	Ether / IP / TCP 152.195.38.76:http > 192.168.1.101:49555 SA
04/11/2024 07:08:53	en0	Ether / IP / TCP 152.195.38.76:http > 192.168.1.101:49555 SA
04/11/2024 07:08:53	en0	Ether / IP / TCP 152.195.38.76:http > 192.168.1.101:49555 SA
04/11/2024 07:08:53	en0	Ether / IP / TCP 192.168.1.101:49555 > 152.195.38.76:http A
04/11/2024 07:08:53	en0	Ether / IP / TCP 192.168.1.101:49555 > 152.195.38.76:http A
04/11/2024 07:08:53	en0	Ether / IP / TCP / HTTP / GET '/ME8wTTBLMEkwRzAHBgUrDgMCGgQU6468nUcrfgKRdxkj8qXxwcUeV7UEFLPbSKT5ocXYrjZBzBFjaWIpvEvGAhAMq6rRzsTpfMJmWIHQITj3' 
04/11/2024 07:08:53	en0	Ether / IP / TCP / HTTP / GET '/ME8wTTBLMEkwRzAHBgUrDgMCGgQU6468nUcrfgKRdxkj8qXxwcUeV7UEFLPbSKT5ocXYrjZBzBFjaWIpvEvGAhAMq6rRzsTpfMJmWIHQITj3' 
04/11/2024 07:08:53	en0	Ether / IP / TCP 152.195.38.76:http > 192.168.1.101:49555 A
04/11/2024 07:08:53	en0	Ether / IP / TCP 152.195.38.76:http > 192.168.1.101:49555 A
04/11/2024 07:08:53	en0	Ether / IP / TCP / HTTP / 200 OK / Raw
04/11/2024 07:08:53	en0	Ether / IP / TCP / HTTP / 200 OK / Raw
04/11/2024 07:08:53	en0	Ether / IP / TCP 192.168.1.101:49555 > 152.195.38.76:http A
04/11/2024 07:08:53	en0	Ether / IP / TCP 192.168.1.101:49555 > 152.195.38.76:http A
04/11/2024 07:31:37	en0	Ether / IP / TCP 192.168.1.101:49544 > 192.124.249.23:http FA
04/11/2024 07:31:37	en0	Ether / IP / TCP 192.168.1.101:49544 > 192.124.249.23:http FA
04/11/2024 07:31:37	en0	Ether / IP / TCP 192.168.1.101:49544 > 192.124.249.23:http FA
04/11/2024 07:31:37	en0	Ether / IP / TCP 192.168.1.101:49544 > 192.124.249.23:http FA
04/11/2024 07:31:38	en0	Ether / IP / TCP 192.168.1.101:49544 > 192.124.249.23:http FA
04/11/2024 07:31:38	en0	Ether / IP / TCP 192.168.1.101:49544 > 192.124.249.23:http FA
04/11/2024 07:31:38	en0	Ether / IP / TCP 192.168.1.101:49550 > 152.195.38.76:http FA
04/11/2024 07:31:38	en0	Ether / IP / TCP 192.168.1.101:49550 > 152.195.38.76:http FA
04/11/2024 07:31:39	en0	Ether / IP / TCP 192.168.1.101:49550 > 152.195.38.76:http FA
04/11/2024 07:31:39	en0	Ether / IP / TCP 192.168.1.101:49550 > 152.195.38.76:http FA
04/11/2024 07:31:39	en0	Ether / IP / TCP 192.168.1.101:49550 > 152.195.38.76:http FA
04/11/2024 07:31:39	en0	Ether / IP / TCP 192.168.1.101:49550 > 152.195.38.76:http FA
04/11/2024 07:31:39	en0	Ether / IP / TCP 192.168.1.101:49555 > 152.195.38.76:http FA
04/11/2024 07:31:39	en0	Ether / IP / TCP 192.168.1.101:49555 > 152.195.38.76:http FA
04/11/2024 07:31:39	en0	Ether / IP / TCP 192.168.1.101:49544 > 192.124.249.23:http FA
04/11/2024 07:31:39	en0	Ether / IP / TCP 192.168.1.101:49544 > 192.124.249.23:http FA
04/11/2024 07:31:39	en0	Ether / IP / TCP 192.168.1.101:49555 > 152.195.38.76:http FA
04/11/2024 07:31:39	en0	Ether / IP / TCP 192.168.1.101:49555 > 152.195.38.76:http FA
04/11/2024 07:31:39	en0	Ether / IP / TCP 192.168.1.101:49550 > 152.195.38.76:http FA
04/11/2024 07:31:39	en0	Ether / IP / TCP 192.168.1.101:49550 > 152.195.38.76:http FA
04/11/2024 07:31:40	en0	Ether / IP / TCP 192.168.1.101:49555 > 152.195.38.76:http FA
04/11/2024 07:31:40	en0	Ether / IP / TCP 192.168.1.101:49555 > 152.195.38.76:http FA
04/11/2024 07:31:40	en0	Ether / IP / TCP 192.168.1.101:49550 > 152.195.38.76:http FA
04/11/2024 07:31:40	en0	Ether / IP / TCP 192.168.1.101:49550 > 152.195.38.76:http FA
04/11/2024 07:31:41	en0	Ether / IP / TCP 192.168.1.101:49555 > 152.195.38.76:http FA
04/11/2024 07:31:41	en0	Ether / IP / TCP 192.168.1.101:49555 > 152.195.38.76:http FA
04/11/2024 07:31:41	en0	Ether / IP / TCP 192.168.1.101:49550 > 152.195.38.76:http FA
04/11/2024 07:31:41	en0	Ether / IP / TCP 192.168.1.101:49550 > 152.195.38.76:http FA
04/11/2024 07:31:42	en0	Ether / IP / TCP 192.168.1.101:49544 > 192.124.249.23:http FA
04/11/2024 07:31:42	en0	Ether / IP / TCP 192.168.1.101:49544 > 192.124.249.23:http FA
04/11/2024 07:31:42	en0	Ether / IP / TCP 192.168.1.101:49555 > 152.195.38.76:http FA
04/11/2024 07:31:42	en0	Ether / IP / TCP 192.168.1.101:49555 > 152.195.38.76:http FA
04/11/2024 07:31:43	en0	Ether / IP / TCP 192.168.1.101:49550 > 152.195.38.76:http FA
04/11/2024 07:31:43	en0	Ether / IP / TCP 192.168.1.101:49550 > 152.195.38.76:http FA
04/11/2024 07:31:45	en0	Ether / IP / TCP 192.168.1.101:49555 > 152.195.38.76:http FA
04/11/2024 07:31:45	en0	Ether / IP / TCP 192.168.1.101:49555 > 152.195.38.76:http FA
04/11/2024 07:31:46	en0	Ether / IP / TCP 192.168.1.101:49550 > 152.195.38.76:http FA
04/11/2024 07:31:46	en0	Ether / IP / TCP 192.168.1.101:49550 > 152.195.38.76:http FA
04/11/2024 07:31:48	en0	Ether / IP / TCP 192.168.1.101:49544 > 192.124.249.23:http FA
04/11/2024 07:31:48	en0	Ether / IP / TCP 192.168.1.101:49544 > 192.124.249.23:http FA
04/11/2024 07:31:49	en0	Ether / IP / TCP 192.168.1.101:49550 > 152.195.38.76:http FA
04/11/2024 07:31:49	en0	Ether / IP / TCP 192.168.1.101:49550 > 152.195.38.76:http FA
04/11/2024 07:31:50	en0	Ether / IP / TCP 192.168.1.101:49555 > 152.195.38.76:http FA
04/11/2024 07:31:50	en0	Ether / IP / TCP 192.168.1.101:49555 > 152.195.38.76:http FA
04/11/2024 07:31:52	en0	Ether / IP / TCP 192.168.1.101:49550 > 152.195.38.76:http FA
04/11/2024 07:31:52	en0	Ether / IP / TCP 192.168.1.101:49550 > 152.195.38.76:http FA
04/11/2024 07:31:55	en0	Ether / IP / TCP 192.168.1.101:49550 > 152.195.38.76:http FA
04/11/2024 07:31:55	en0	Ether / IP / TCP 192.168.1.101:49550 > 152.195.38.76:http FA
04/11/2024 07:32:02	en0	Ether / IP / TCP 192.168.1.101:49544 > 192.124.249.23:http FA
04/11/2024 07:32:02	en0	Ether / IP / TCP 192.168.1.101:49544 > 192.124.249.23:http FA
04/11/2024 07:32:04	en0	Ether / IP / TCP 192.168.1.101:49550 > 152.195.38.76:http FA
04/11/2024 07:32:04	en0	Ether / IP / TCP 192.168.1.101:49550 > 152.195.38.76:http FA
04/11/2024 07:32:06	en0	Ether / IP / TCP 192.168.1.101:49555 > 152.195.38.76:http FA
04/11/2024 07:32:06	en0	Ether / IP / TCP 192.168.1.101:49555 > 152.195.38.76:http FA
04/11/2024 07:32:07	en0	Ether / IP / TCP 192.168.1.101:49550 > 152.195.38.76:http FA
04/11/2024 07:32:07	en0	Ether / IP / TCP 192.168.1.101:49550 > 152.195.38.76:http FA
04/11/2024 07:32:10	en0	Ether / IP / TCP 192.168.1.101:49550 > 152.195.38.76:http RA
04/11/2024 07:32:10	en0	Ether / IP / TCP 192.168.1.101:49550 > 152.195.38.76:http RA
04/11/2024 07:32:16	en0	Ether / IP / TCP 192.168.1.101:49555 > 152.195.38.76:http FA
04/11/2024 07:32:16	en0	Ether / IP / TCP 192.168.1.101:49555 > 152.195.38.76:http FA
04/11/2024 07:32:18	en0	Ether / IP / TCP 192.168.1.101:49544 > 192.124.249.23:http FA
04/11/2024 07:32:18	en0	Ether / IP / TCP 192.168.1.101:49544 > 192.124.249.23:http FA
04/11/2024 07:32:26	en0	Ether / IP / TCP 192.168.1.101:49555 > 152.195.38.76:http FA
04/11/2024 07:32:26	en0	Ether / IP / TCP 192.168.1.101:49555 > 152.195.38.76:http FA
04/11/2024 07:32:34	en0	Ether / IP / TCP 192.168.1.101:49544 > 192.124.249.23:http FA
04/11/2024 07:32:34	en0	Ether / IP / TCP 192.168.1.101:49544 > 192.124.249.23:http FA
04/11/2024 07:32:35	en0	Ether / IP / TCP 192.168.1.101:49555 > 152.195.38.76:http FA
04/11/2024 07:32:35	en0	Ether / IP / TCP 192.168.1.101:49555 > 152.195.38.76:http FA
04/11/2024 07:32:45	en0	Ether / IP / TCP 192.168.1.101:49555 > 152.195.38.76:http FA
04/11/2024 07:32:45	en0	Ether / IP / TCP 192.168.1.101:49555 > 152.195.38.76:http FA
04/11/2024 07:32:49	en0	Ether / IP / TCP 192.168.1.101:49544 > 192.124.249.23:http FA
04/11/2024 07:32:49	en0	Ether / IP / TCP 192.168.1.101:49544 > 192.124.249.23:http FA
04/11/2024 07:32:54	en0	Ether / IP / TCP 192.168.1.101:49555 > 152.195.38.76:http FA
04/11/2024 07:32:54	en0	Ether / IP / TCP 192.168.1.101:49555 > 152.195.38.76:http FA
04/11/2024 07:33:04	en0	Ether / IP / TCP 192.168.1.101:49555 > 152.195.38.76:http RA
04/11/2024 07:33:04	en0	Ether / IP / TCP 192.168.1.101:49555 > 152.195.38.76:http RA
04/11/2024 07:33:05	en0	Ether / IP / TCP 192.168.1.101:49544 > 192.124.249.23:http FA
04/11/2024 07:33:05	en0	Ether / IP / TCP 192.168.1.101:49544 > 192.124.249.23:http FA
04/11/2024 07:33:20	en0	Ether / IP / TCP 192.168.1.101:49544 > 192.124.249.23:http FA
04/11/2024 07:33:20	en0	Ether / IP / TCP 192.168.1.101:49544 > 192.124.249.23:http FA
04/11/2024 07:33:36	en0	Ether / IP / TCP 192.168.1.101:49544 > 192.124.249.23:http FA
04/11/2024 07:33:36	en0	Ether / IP / TCP 192.168.1.101:49544 > 192.124.249.23:http FA
04/11/2024 07:33:51	en0	Ether / IP / TCP 192.168.1.101:49544 > 192.124.249.23:http RA
04/11/2024 07:33:51	en0	Ether / IP / TCP 192.168.1.101:49544 > 192.124.249.23:http RA
04/11/2024 07:36:42	en0	Ether / IP / TCP 192.168.1.101:49691 > 152.195.38.76:http S
04/11/2024 07:36:42	en0	Ether / IP / TCP 192.168.1.101:49691 > 152.195.38.76:http S
04/11/2024 07:36:42	en0	Ether / IP / TCP 152.195.38.76:http > 192.168.1.101:49691 SA
04/11/2024 07:36:42	en0	Ether / IP / TCP 152.195.38.76:http > 192.168.1.101:49691 SA
04/11/2024 07:36:42	en0	Ether / IP / TCP 192.168.1.101:49691 > 152.195.38.76:http A
04/11/2024 07:36:42	en0	Ether / IP / TCP 192.168.1.101:49691 > 152.195.38.76:http A
04/11/2024 07:36:42	en0	Ether / IP / TCP / HTTP / GET '/ME8wTTBLMEkwRzAHBgUrDgMCGgQU36oS4yixCUGT4p9Cgs5HQEKVWKMEFLE%2Bw2kD%2BL9HAdSYJhoIAu9jZCvDAhAHF3kRAF0iZ%2FaIkvaPi1BY' 
04/11/2024 07:36:42	en0	Ether / IP / TCP / HTTP / GET '/ME8wTTBLMEkwRzAHBgUrDgMCGgQU36oS4yixCUGT4p9Cgs5HQEKVWKMEFLE%2Bw2kD%2BL9HAdSYJhoIAu9jZCvDAhAHF3kRAF0iZ%2FaIkvaPi1BY' 
04/11/2024 07:36:42	en0	Ether / IP / TCP 152.195.38.76:http > 192.168.1.101:49691 A
04/11/2024 07:36:42	en0	Ether / IP / TCP 152.195.38.76:http > 192.168.1.101:49691 A
04/11/2024 07:36:42	en0	Ether / IP / TCP / HTTP / 200 OK / Raw
04/11/2024 07:36:42	en0	Ether / IP / TCP / HTTP / 200 OK / Raw
04/11/2024 07:36:42	en0	Ether / IP / TCP 192.168.1.101:49691 > 152.195.38.76:http A
04/11/2024 07:36:42	en0	Ether / IP / TCP 192.168.1.101:49691 > 152.195.38.76:http A
04/11/2024 07:36:48	en0	Ether / IP / TCP 192.168.1.101:49704 > 152.195.38.76:http S
04/11/2024 07:36:48	en0	Ether / IP / TCP 192.168.1.101:49704 > 152.195.38.76:http S
04/11/2024 07:36:48	en0	Ether / IP / TCP 152.195.38.76:http > 192.168.1.101:49704 SA
04/11/2024 07:36:48	en0	Ether / IP / TCP 152.195.38.76:http > 192.168.1.101:49704 SA
04/11/2024 07:36:48	en0	Ether / IP / TCP 192.168.1.101:49704 > 152.195.38.76:http A
04/11/2024 07:36:48	en0	Ether / IP / TCP 192.168.1.101:49704 > 152.195.38.76:http A
04/11/2024 07:36:48	en0	Ether / IP / TCP / HTTP / GET '/ME8wTTBLMEkwRzAHBgUrDgMCGgQU36oS4yixCUGT4p9Cgs5HQEKVWKMEFLE%2Bw2kD%2BL9HAdSYJhoIAu9jZCvDAhAHF3kRAF0iZ%2FaIkvaPi1BY' 
04/11/2024 07:36:48	en0	Ether / IP / TCP / HTTP / GET '/ME8wTTBLMEkwRzAHBgUrDgMCGgQU36oS4yixCUGT4p9Cgs5HQEKVWKMEFLE%2Bw2kD%2BL9HAdSYJhoIAu9jZCvDAhAHF3kRAF0iZ%2FaIkvaPi1BY' 
04/11/2024 07:36:48	en0	Ether / IP / TCP 152.195.38.76:http > 192.168.1.101:49704 A
04/11/2024 07:36:48	en0	Ether / IP / TCP 152.195.38.76:http > 192.168.1.101:49704 A
04/11/2024 07:36:48	en0	Ether / IP / TCP / HTTP / 200 OK / Raw
04/11/2024 07:36:48	en0	Ether / IP / TCP / HTTP / 200 OK / Raw
04/11/2024 07:36:48	en0	Ether / IP / TCP 192.168.1.101:49704 > 152.195.38.76:http A
04/11/2024 07:36:48	en0	Ether / IP / TCP 192.168.1.101:49704 > 152.195.38.76:http A
04/11/2024 07:37:12	en0	Ether / IP / TCP 192.168.1.101:49691 > 152.195.38.76:http FA
04/11/2024 07:37:12	en0	Ether / IP / TCP 192.168.1.101:49691 > 152.195.38.76:http FA
04/11/2024 07:37:12	en0	Ether / IP / TCP 152.195.38.76:http > 192.168.1.101:49691 FA
04/11/2024 07:37:12	en0	Ether / IP / TCP 152.195.38.76:http > 192.168.1.101:49691 FA
04/11/2024 07:37:12	en0	Ether / IP / TCP 192.168.1.101:49691 > 152.195.38.76:http A
04/11/2024 07:37:12	en0	Ether / IP / TCP 192.168.1.101:49691 > 152.195.38.76:http A
04/11/2024 07:37:18	en0	Ether / IP / TCP 192.168.1.101:49704 > 152.195.38.76:http FA
04/11/2024 07:37:18	en0	Ether / IP / TCP 192.168.1.101:49704 > 152.195.38.76:http FA
04/11/2024 07:37:18	en0	Ether / IP / TCP 152.195.38.76:http > 192.168.1.101:49704 FA
04/11/2024 07:37:18	en0	Ether / IP / TCP 152.195.38.76:http > 192.168.1.101:49704 FA
04/11/2024 07:37:18	en0	Ether / IP / TCP 192.168.1.101:49704 > 152.195.38.76:http A
04/11/2024 07:37:18	en0	Ether / IP / TCP 192.168.1.101:49704 > 152.195.38.76:http A
04/11/2024 07:42:36	en0	Ether / IP / TCP 192.168.1.101:58131 > 111.119.8.1:http S
04/11/2024 07:42:36	en0	Ether / IP / TCP 192.168.1.101:58131 > 111.119.8.1:http S
04/11/2024 07:42:36	en0	Ether / IP / TCP 111.119.8.1:http > 192.168.1.101:58131 SA
04/11/2024 07:42:36	en0	Ether / IP / TCP 111.119.8.1:http > 192.168.1.101:58131 SA
04/11/2024 07:42:36	en0	Ether / IP / TCP 192.168.1.101:58131 > 111.119.8.1:http A
04/11/2024 07:42:36	en0	Ether / IP / TCP 192.168.1.101:58131 > 111.119.8.1:http A
04/11/2024 07:42:36	en0	Ether / IP / TCP / HTTP / GET '/filestreamingservice/files/6ff331c8-98e0-4c62-b368-5947ff7f2390?P1=1731225326&P2=404&P3=2&P4=XLLyevQHn8RueiNBb1gn62wDg7rHFwO2wDAW6aBItGcqLqYDGE6INu1wyRgeVVJsZ1AuW4THoC2rZ9Ixt7EDrQ%3d%3d' 
04/11/2024 07:42:36	en0	Ether / IP / TCP / HTTP / GET '/filestreamingservice/files/6ff331c8-98e0-4c62-b368-5947ff7f2390?P1=1731225326&P2=404&P3=2&P4=XLLyevQHn8RueiNBb1gn62wDg7rHFwO2wDAW6aBItGcqLqYDGE6INu1wyRgeVVJsZ1AuW4THoC2rZ9Ixt7EDrQ%3d%3d' 
04/11/2024 07:42:36	en0	Ether / IP / TCP / HTTP / 200 OK / Raw
04/11/2024 07:42:36	en0	Ether / IP / TCP / HTTP / 200 OK / Raw
04/11/2024 07:42:36	en0	Ether / IP / TCP 192.168.1.101:58131 > 111.119.8.1:http A
04/11/2024 07:42:36	en0	Ether / IP / TCP 192.168.1.101:58131 > 111.119.8.1:http A
04/11/2024 07:42:36	en0	Ether / IP / TCP 111.119.8.1:http > 192.168.1.101:58131 A / HTTP / Raw
04/11/2024 07:42:36	en0	Ether / IP / TCP 111.119.8.1:http > 192.168.1.101:58131 A / HTTP / Raw
04/11/2024 07:42:36	en0	Ether / IP / TCP 111.119.8.1:http > 192.168.1.101:58131 A / HTTP / Raw
04/11/2024 07:42:36	en0	Ether / IP / TCP 192.168.1.101:58131 > 111.119.8.1:http A
04/11/2024 07:42:36	en0	Ether / IP / TCP 192.168.1.101:58131 > 111.119.8.1:http A
04/11/2024 07:42:36	en0	Ether / IP / TCP 111.119.8.1:http > 192.168.1.101:58131 A / HTTP / Raw
04/11/2024 07:42:36	en0	Ether / IP / TCP 111.119.8.1:http > 192.168.1.101:58131 A / HTTP / Raw
04/11/2024 07:42:36	en0	Ether / IP / TCP 192.168.1.101:58131 > 111.119.8.1:http A
04/11/2024 07:42:36	en0	Ether / IP / TCP 111.119.8.1:http > 192.168.1.101:58131 PA / HTTP / Raw
04/11/2024 07:42:36	en0	Ether / IP / TCP 192.168.1.101:58131 > 111.119.8.1:http A
04/11/2024 07:42:36	en0	Ether / IP / TCP 192.168.1.101:58131 > 111.119.8.1:http A
04/11/2024 07:42:36	en0	Ether / IP / TCP 111.119.8.1:http > 192.168.1.101:58131 A / HTTP / Raw
04/11/2024 07:42:36	en0	Ether / IP / TCP 192.168.1.101:58131 > 111.119.8.1:http A
04/11/2024 07:42:36	en0	Ether / IP / TCP 111.119.8.1:http > 192.168.1.101:58131 PA / HTTP / Raw
04/11/2024 07:42:36	en0	Ether / IP / TCP 111.119.8.1:http > 192.168.1.101:58131 A / HTTP / Raw
04/11/2024 07:42:36	en0	Ether / IP / TCP 192.168.1.101:58131 > 111.119.8.1:http A
04/11/2024 07:42:36	en0	Ether / IP / TCP 192.168.1.101:58131 > 111.119.8.1:http A
04/11/2024 07:42:36	en0	Ether / IP / TCP 111.119.8.1:http > 192.168.1.101:58131 A / HTTP / Raw
04/11/2024 07:42:36	en0	Ether / IP / TCP 111.119.8.1:http > 192.168.1.101:58131 A / HTTP / Raw
04/11/2024 07:42:36	en0	Ether / IP / TCP 111.119.8.1:http > 192.168.1.101:58131 A / HTTP / Raw
04/11/2024 07:42:36	en0	Ether / IP / TCP 111.119.8.1:http > 192.168.1.101:58131 A / HTTP / Raw
04/11/2024 07:42:36	en0	Ether / IP / TCP 111.119.8.1:http > 192.168.1.101:58131 A / HTTP / Raw
04/11/2024 07:42:36	en0	Ether / IP / TCP 111.119.8.1:http > 192.168.1.101:58131 A / HTTP / Raw
04/11/2024 07:42:36	en0	Ether / IP / TCP 111.119.8.1:http > 192.168.1.101:58131 A / HTTP / Raw
04/11/2024 07:42:36	en0	Ether / IP / TCP 111.119.8.1:http > 192.168.1.101:58131 PA / HTTP / Raw
04/11/2024 07:42:36	en0	Ether / IP / TCP 111.119.8.1:http > 192.168.1.101:58131 PA / HTTP / Raw
04/11/2024 07:42:36	en0	Ether / IP / TCP 111.119.8.1:http > 192.168.1.101:58131 A / HTTP / Raw
04/11/2024 07:42:36	en0	Ether / IP / TCP 111.119.8.1:http > 192.168.1.101:58131 A / HTTP / Raw
04/11/2024 07:42:36	en0	Ether / IP / TCP 111.119.8.1:http > 192.168.1.101:58131 A / HTTP / Raw
04/11/2024 07:42:36	en0	Ether / IP / TCP 111.119.8.1:http > 192.168.1.101:58131 A / HTTP / Raw
04/11/2024 07:42:36	en0	Ether / IP / TCP 111.119.8.1:http > 192.168.1.101:58131 A / HTTP / Raw
04/11/2024 07:42:36	en0	Ether / IP / TCP 111.119.8.1:http > 192.168.1.101:58131 A / HTTP / Raw
04/11/2024 07:42:36	en0	Ether / IP / TCP 192.168.1.101:58131 > 111.119.8.1:http A
04/11/2024 07:42:36	en0	Ether / IP / TCP 192.168.1.101:58131 > 111.119.8.1:http A
04/11/2024 07:42:36	en0	Ether / IP / TCP 111.119.8.1:http > 192.168.1.101:58131 A / HTTP / Raw
04/11/2024 07:42:36	en0	Ether / IP / TCP 111.119.8.1:http > 192.168.1.101:58131 A / HTTP / Raw
04/11/2024 07:42:36	en0	Ether / IP / TCP 111.119.8.1:http > 192.168.1.101:58131 A / HTTP / Raw
04/11/2024 07:42:36	en0	Ether / IP / TCP 111.119.8.1:http > 192.168.1.101:58131 A / HTTP / Raw
04/11/2024 07:42:36	en0	Ether / IP / TCP 111.119.8.1:http > 192.168.1.101:58131 A / HTTP / Raw
04/11/2024 07:42:36	en0	Ether / IP / TCP 192.168.1.101:58131 > 111.119.8.1:http A
04/11/2024 07:42:36	en0	Ether / IP / TCP 111.119.8.1:http > 192.168.1.101:58131 A / HTTP / Raw
04/11/2024 07:42:36	en0	Ether / IP / TCP 192.168.1.101:58131 > 111.119.8.1:http A
04/11/2024 07:42:36	en0	Ether / IP / TCP 111.119.8.1:http > 192.168.1.101:58131 A / HTTP / Raw
04/11/2024 07:42:36	en0	Ether / IP / TCP 111.119.8.1:http > 192.168.1.101:58131 A / HTTP / Raw
04/11/2024 07:42:36	en0	Ether / IP / TCP 111.119.8.1:http > 192.168.1.101:58131 A / HTTP / Raw
04/11/2024 07:42:36	en0	Ether / IP / TCP 111.119.8.1:http > 192.168.1.101:58131 A / HTTP / Raw
04/11/2024 07:42:36	en0	Ether / IP / TCP 111.119.8.1:http > 192.168.1.101:58131 PA / HTTP / Raw
04/11/2024 07:42:36	en0	Ether / IP / TCP 111.119.8.1:http > 192.168.1.101:58131 A / HTTP / Raw
04/11/2024 07:42:36	en0	Ether / IP / TCP 111.119.8.1:http > 192.168.1.101:58131 A / HTTP / Raw
04/11/2024 07:42:36	en0	Ether / IP / TCP 111.119.8.1:http > 192.168.1.101:58131 A / HTTP / Raw
04/11/2024 07:42:36	en0	Ether / IP / TCP 111.119.8.1:http > 192.168.1.101:58131 A / HTTP / Raw
04/11/2024 07:42:36	en0	Ether / IP / TCP 111.119.8.1:http > 192.168.1.101:58131 A / HTTP / Raw
04/11/2024 07:42:36	en0	Ether / IP / TCP 111.119.8.1:http > 192.168.1.101:58131 A / HTTP / Raw
04/11/2024 07:42:36	en0	Ether / IP / TCP 111.119.8.1:http > 192.168.1.101:58131 PA / HTTP / Raw
04/11/2024 07:42:36	en0	Ether / IP / TCP 111.119.8.1:http > 192.168.1.101:58131 A / HTTP / Raw
04/11/2024 07:42:36	en0	Ether / IP / TCP 192.168.1.101:58131 > 111.119.8.1:http A
04/11/2024 07:42:36	en0	Ether / IP / TCP 192.168.1.101:58131 > 111.119.8.1:http A
04/11/2024 07:42:36	en0	Ether / IP / TCP 111.119.8.1:http > 192.168.1.101:58131 PA / HTTP / Raw
04/11/2024 07:42:36	en0	Ether / IP / TCP 111.119.8.1:http > 192.168.1.101:58131 A / HTTP / Raw
04/11/2024 07:42:36	en0	Ether / IP / TCP 111.119.8.1:http > 192.168.1.101:58131 A / HTTP / Raw
04/11/2024 07:42:36	en0	Ether / IP / TCP 111.119.8.1:http > 192.168.1.101:58131 A / HTTP / Raw
04/11/2024 07:42:36	en0	Ether / IP / TCP 111.119.8.1:http > 192.168.1.101:58131 PA / HTTP / Raw
04/11/2024 07:42:36	en0	Ether / IP / TCP 192.168.1.101:58131 > 111.119.8.1:http A
04/11/2024 07:42:36	en0	Ether / IP / TCP 192.168.1.101:58131 > 111.119.8.1:http A
04/11/2024 07:42:58	en0	Ether / IP / TCP 192.168.1.101:58131 > 111.119.8.1:http FA
04/11/2024 07:42:58	en0	Ether / IP / TCP 192.168.1.101:58131 > 111.119.8.1:http FA
04/11/2024 07:42:58	en0	Ether / IP / TCP 111.119.8.1:http > 192.168.1.101:58131 FA
04/11/2024 07:42:58	en0	Ether / IP / TCP 111.119.8.1:http > 192.168.1.101:58131 FA
04/11/2024 07:42:58	en0	Ether / IP / TCP 192.168.1.101:58131 > 111.119.8.1:http A
04/11/2024 07:42:58	en0	Ether / IP / TCP 192.168.1.101:58131 > 111.119.8.1:http A
04/11/2024 08:34:32	en0	Ether / IP / TCP 192.168.1.101:50236 > 23.92.19.208:http S
04/11/2024 08:34:32	en0	Ether / IP / TCP 192.168.1.101:50236 > 23.92.19.208:http S
04/11/2024 08:34:32	en0	Ether / IP / TCP 192.168.1.101:50237 > 23.92.19.208:http S
04/11/2024 08:34:32	en0	Ether / IP / TCP 192.168.1.101:50237 > 23.92.19.208:http S
04/11/2024 08:34:32	en0	Ether / IP / TCP 23.92.19.208:http > 192.168.1.101:50236 SA
04/11/2024 08:34:32	en0	Ether / IP / TCP 23.92.19.208:http > 192.168.1.101:50236 SA
04/11/2024 08:34:32	en0	Ether / IP / TCP 192.168.1.101:50236 > 23.92.19.208:http A
04/11/2024 08:34:32	en0	Ether / IP / TCP 192.168.1.101:50236 > 23.92.19.208:http A
04/11/2024 08:34:32	en0	Ether / IP / TCP 23.92.19.208:http > 192.168.1.101:50237 SA
04/11/2024 08:34:32	en0	Ether / IP / TCP 23.92.19.208:http > 192.168.1.101:50237 SA
04/11/2024 08:34:32	en0	Ether / IP / TCP 192.168.1.101:50237 > 23.92.19.208:http A
04/11/2024 08:34:32	en0	Ether / IP / TCP 192.168.1.101:50237 > 23.92.19.208:http A
04/11/2024 08:34:32	en0	Ether / IP / TCP / HTTP / GET '/how-to-turn-a-raspberry-pi-into-a-wifi-router/' 
04/11/2024 08:34:32	en0	Ether / IP / TCP / HTTP / GET '/how-to-turn-a-raspberry-pi-into-a-wifi-router/' 
04/11/2024 08:34:32	en0	Ether / IP / TCP 23.92.19.208:http > 192.168.1.101:50237 A
04/11/2024 08:34:32	en0	Ether / IP / TCP 23.92.19.208:http > 192.168.1.101:50237 A
04/11/2024 08:34:32	en0	Ether / IP / TCP / HTTP / 301 Moved Permanently / Raw
04/11/2024 08:34:32	en0	Ether / IP / TCP / HTTP / 301 Moved Permanently / Raw
04/11/2024 08:34:32	en0	Ether / IP / TCP 192.168.1.101:50237 > 23.92.19.208:http A
04/11/2024 08:34:32	en0	Ether / IP / TCP 192.168.1.101:50237 > 23.92.19.208:http A
04/11/2024 08:34:35	en0	Ether / IP / TCP / HTTP / GET '/how-to-turn-a-raspberry-pi-into-a-wifi-router/' 
04/11/2024 08:34:35	en0	Ether / IP / TCP / HTTP / GET '/how-to-turn-a-raspberry-pi-into-a-wifi-router/' 
04/11/2024 08:34:35	en0	Ether / IP / TCP 23.92.19.208:http > 192.168.1.101:50236 A
04/11/2024 08:34:35	en0	Ether / IP / TCP 23.92.19.208:http > 192.168.1.101:50236 A
04/11/2024 08:34:35	en0	Ether / IP / TCP / HTTP / 301 Moved Permanently / Raw
04/11/2024 08:34:35	en0	Ether / IP / TCP / HTTP / 301 Moved Permanently / Raw
04/11/2024 08:34:35	en0	Ether / IP / TCP 192.168.1.101:50236 > 23.92.19.208:http A
04/11/2024 08:34:35	en0	Ether / IP / TCP 192.168.1.101:50236 > 23.92.19.208:http A
04/11/2024 08:34:37	en0	Ether / IP / TCP 192.168.1.101:50237 > 23.92.19.208:http FA
04/11/2024 08:34:37	en0	Ether / IP / TCP 192.168.1.101:50237 > 23.92.19.208:http FA
04/11/2024 08:34:37	en0	Ether / IP / TCP 192.168.1.101:50236 > 23.92.19.208:http FA
04/11/2024 08:34:37	en0	Ether / IP / TCP 192.168.1.101:50236 > 23.92.19.208:http FA
04/11/2024 08:34:37	en0	Ether / IP / TCP 23.92.19.208:http > 192.168.1.101:50237 FA
04/11/2024 08:34:37	en0	Ether / IP / TCP 23.92.19.208:http > 192.168.1.101:50237 FA
04/11/2024 08:34:37	en0	Ether / IP / TCP 192.168.1.101:50237 > 23.92.19.208:http A
04/11/2024 08:34:37	en0	Ether / IP / TCP 192.168.1.101:50237 > 23.92.19.208:http A
04/11/2024 08:34:37	en0	Ether / IP / TCP 23.92.19.208:http > 192.168.1.101:50236 FA
04/11/2024 08:34:37	en0	Ether / IP / TCP 23.92.19.208:http > 192.168.1.101:50236 FA
04/11/2024 08:34:37	en0	Ether / IP / TCP 192.168.1.101:50236 > 23.92.19.208:http A
